{
    "checks": [
        {
            "id": "embedded-fonts",
            "status": "ok"
        },
        {
            "id": "image-resolution",
            "status": "ok"
        },
        {
            "id": "bleed",
            "status": "ok"
        },
        {
            "id": "trim",
            "status": "ok"
        },
        {
            "id": "page-size",
            "status": "ok"
        },
        {
            "id": "color-mode",
            "status": "ok"
        },
        {
            "id": "color-inventory",
            "status": "ok"
        },
        {
            "id": "white-overprint",
            "status": "ok"
        }
    ],
    "errors": [
    ],
    "fixups_available": [
        {
            "description": "Downsample 1 oversized image(s) toward 300 DPI",
            "id": "downsample-images",
            "params": {
                "candidate_count": 1,
                "preserve_color": true,
                "preserve_transparency": true,
                "quality": 90,
                "target_dpi": 300
            },
            "safe": false
        }
    ],
    "inspection_complete": true,
    "pass": true,
    "profile": "Loupe Default",
    "schema_version": 3,
    "warnings": [
        {
            "check_id": "color-inventory",
            "message": "Process output separation: Cyan",
            "object_id": "Cyan",
            "scope": "document",
            "severity": "info",
            "type": "separation"
        },
        {
            "check_id": "color-inventory",
            "message": "Process output separation: Magenta",
            "object_id": "Magenta",
            "scope": "document",
            "severity": "info",
            "type": "separation"
        },
        {
            "check_id": "color-inventory",
            "message": "Process output separation: Yellow",
            "object_id": "Yellow",
            "scope": "document",
            "severity": "info",
            "type": "separation"
        },
        {
            "check_id": "color-inventory",
            "message": "Process output separation: Black",
            "object_id": "Black",
            "scope": "document",
            "severity": "info",
            "type": "separation"
        }
    ]
}
