{
    "checks": [
        {
            "id": "output-intent",
            "status": "failed"
        }
    ],
    "errors": [
        {
            "check_id": "output-intent",
            "message": "Output intent 'CGATS TR 001' has no embedded ICC profile (/DestOutputProfile is missing or is not a stream).",
            "scope": "document",
            "severity": "error",
            "type": "output-intent-profile-missing"
        }
    ],
    "fixups_available": [
    ],
    "inspection_complete": true,
    "pass": false,
    "profile": "Loupe Test - Output Intent",
    "schema_version": 3,
    "warnings": [
    ]
}
